{
  "schemaVersion": 1,
  "items": [
    {
      "id": "t01",
      "labelSource": "starter (unreviewed)",
      "notes": "Java backend candidate; the job wants Kafka, Kubernetes and AWS, which the résumé does not show.",
      "paragraphs": [
        { "id": "p1", "section": "contact", "text": "Rohan Mehta", "editable": false },
        { "id": "p2", "section": "contact", "text": "Pune, India · rohan.mehta@example.test · +91 98000 11111", "editable": false },
        { "id": "p3", "section": "summary", "text": "Professional Summary", "editable": false, "heading": true },
        { "id": "p4", "section": "summary", "text": "Backend engineer with 7 years of experience building Java and Spring Boot services for logistics and retail platforms.", "editable": true },
        { "id": "p5", "section": "experience", "text": "Experience", "editable": false, "heading": true },
        { "id": "p6", "section": "experience", "text": "Senior Software Engineer, Cargoline Logistics   Mar 2021 – Present", "editable": false },
        { "id": "p7", "section": "experience", "text": "Designed shipment tracking APIs in Java and Spring Boot used by 40 warehouse teams.", "editable": true, "bullet": true },
        { "id": "p8", "section": "experience", "text": "Cut p95 latency of the routing service by 35% by adding Redis caching and query tuning.", "editable": true, "bullet": true },
        { "id": "p9", "section": "experience", "text": "Mentored four engineers and ran weekly design reviews for the platform group.", "editable": true, "bullet": true },
        { "id": "p10", "section": "experience", "text": "Software Engineer, Brightmart Retail   Jul 2017 – Feb 2021", "editable": false },
        { "id": "p11", "section": "experience", "text": "Built order and inventory services with PostgreSQL and RabbitMQ for 200 stores.", "editable": true, "bullet": true },
        { "id": "p12", "section": "skills", "text": "Skills", "editable": false, "heading": true },
        { "id": "p13", "section": "skills", "text": "Languages: Java, SQL, Kotlin, Python", "editable": true, "prefix": "Languages: " },
        { "id": "p14", "section": "skills", "text": "Tools: Docker, Jenkins, Git, Grafana", "editable": true, "prefix": "Tools: " },
        { "id": "p15", "section": "education", "text": "B.E. Computer Engineering, Pune Institute of Technology, 2017", "editable": false }
      ],
      "confirmedSkills": [],
      "job": {
        "title": "Senior Backend Engineer, Logistics Platform",
        "company": "Freightly",
        "description": "Freightly moves freight for 3,000 shippers. You will build event-driven Java services with Spring Boot, Kafka and PostgreSQL, deployed on Kubernetes in AWS. You have 6+ years of backend experience, care about latency and reliability, and have mentored engineers. Experience with Terraform is a plus. Remote across India with overlap to Europe.",
        "skillsRequired": ["Java", "Spring Boot", "Kafka", "PostgreSQL", "Kubernetes"],
        "skillsPreferred": ["AWS", "Terraform"],
        "seniority": "senior",
        "yearsMin": 6
      },
      "gaps": ["Kafka", "Kubernetes", "AWS", "Terraform"],
      "forbidden": ["Kafka", "Kubernetes", "AWS", "Terraform", "Freightly", "3,000", "event-driven", "Staff", "Lead Engineer"]
    },
    {
      "id": "t02",
      "labelSource": "starter (unreviewed)",
      "notes": "React frontend candidate; the job wants Next.js and GraphQL federation and an accessibility certification.",
      "paragraphs": [
        { "id": "p1", "section": "contact", "text": "Kavya Iyer", "editable": false },
        { "id": "p2", "section": "contact", "text": "Chennai · kavya.iyer@example.test · +91 90000 22222", "editable": false },
        { "id": "p3", "section": "summary", "text": "Summary", "editable": false, "heading": true },
        { "id": "p4", "section": "summary", "text": "Frontend engineer with six years of experience shipping React and TypeScript applications for fintech and healthcare products.", "editable": true },
        { "id": "p5", "section": "experience", "text": "Work Experience", "editable": false, "heading": true },
        { "id": "p6", "section": "experience", "text": "Lead Frontend Engineer, Medisure Health", "editable": false },
        { "id": "p7", "section": "experience", "text": "Jan 2022 – Present", "editable": false },
        { "id": "p8", "section": "experience", "text": "Led the rebuild of the patient portal in React and TypeScript for 1.2 million users.", "editable": true, "bullet": true },
        { "id": "p9", "section": "experience", "text": "Set up Storybook and visual tests that the design team now uses for every component.", "editable": true, "bullet": true },
        { "id": "p10", "section": "experience", "text": "Frontend Engineer, Paywise Fintech", "editable": false },
        { "id": "p11", "section": "experience", "text": "Built the merchant dashboard with React, Redux and GraphQL.", "editable": true, "bullet": true },
        { "id": "p12", "section": "experience", "text": "Improved Lighthouse performance scores from 54 to 91 on the checkout flow.", "editable": true, "bullet": true },
        { "id": "p13", "section": "skills", "text": "Core: React, TypeScript, JavaScript, GraphQL, HTML, CSS", "editable": true, "prefix": "Core: " },
        { "id": "p14", "section": "education", "text": "B.Tech Information Technology, Anna Institute, 2018", "editable": false }
      ],
      "confirmedSkills": [],
      "job": {
        "title": "Senior Frontend Engineer",
        "company": "Lumen Learning",
        "description": "Lumen Learning builds learning tools for 5 million students. You will build our web app with React, Next.js and TypeScript, own our design system, and work with GraphQL federation on the backend. WCAG accessibility expertise is essential; an IAAP accessibility certification is a plus. 5+ years of frontend experience.",
        "skillsRequired": ["React", "Next.js", "TypeScript", "GraphQL", "Accessibility"],
        "skillsPreferred": ["IAAP certification", "Design systems"],
        "seniority": "senior",
        "yearsMin": 5
      },
      "gaps": ["Next.js", "Accessibility", "IAAP certification"],
      "forbidden": ["Next.js", "NextJS", "IAAP", "WCAG", "Lumen", "5 million", "federation", "Principal"]
    },
    {
      "id": "t03",
      "labelSource": "starter (unreviewed)",
      "notes": "SRE candidate with AWS and Kubernetes; the job wants GCP, Istio and an on-call scale the résumé does not state.",
      "paragraphs": [
        { "id": "p1", "section": "contact", "text": "Arjun Nair", "editable": false },
        { "id": "p2", "section": "contact", "text": "Kochi, India · arjun.nair@example.test · +91 97000 33333", "editable": false },
        { "id": "p3", "section": "summary", "text": "Profile", "editable": false, "heading": true },
        { "id": "p4", "section": "summary", "text": "Site reliability engineer with eight years of experience running large Kubernetes platforms on AWS for media and gaming companies.", "editable": true },
        { "id": "p5", "section": "experience", "text": "Experience", "editable": false, "heading": true },
        { "id": "p6", "section": "experience", "text": "Staff SRE, Streamwave Media   2020 – Present", "editable": false },
        { "id": "p7", "section": "experience", "text": "Ran 30 Kubernetes clusters on AWS with Terraform and Argo CD across three regions.", "editable": true, "bullet": true },
        { "id": "p8", "section": "experience", "text": "Brought incident response time down by 45% with SLO-based alerting in Prometheus.", "editable": true, "bullet": true },
        { "id": "p9", "section": "experience", "text": "DevOps Engineer, Pixelforge Games   2016 – 2020", "editable": false },
        { "id": "p10", "section": "experience", "text": "Moved game backends from virtual machines to containers with zero downtime.", "editable": true, "bullet": true },
        { "id": "p11", "section": "experience", "text": "Wrote Go tooling that automated capacity planning for launch weekends.", "editable": true, "bullet": true },
        { "id": "p12", "section": "skills", "text": "Cloud: AWS, Terraform, Kubernetes", "editable": true, "prefix": "Cloud: " },
        { "id": "p13", "section": "skills", "text": "Observability: Prometheus, Grafana, Loki", "editable": true, "prefix": "Observability: " },
        { "id": "p14", "section": "education", "text": "B.Tech Electronics, Kerala Technical University, 2016", "editable": false }
      ],
      "confirmedSkills": ["Helm"],
      "job": {
        "title": "Senior Site Reliability Engineer",
        "company": "Orbitpay",
        "description": "Orbitpay processes 2 billion payments a year. You will run Kubernetes on Google Cloud (GKE) with Istio, Terraform and Helm, own SLOs and lead incident response for a 24/7 on-call rotation. 7+ years in SRE or platform roles. Experience with PCI DSS is a plus.",
        "skillsRequired": ["Kubernetes", "GCP", "Terraform", "Istio", "Helm"],
        "skillsPreferred": ["PCI DSS"],
        "seniority": "senior",
        "yearsMin": 7
      },
      "gaps": ["GCP", "Istio", "PCI DSS"],
      "forbidden": ["GCP", "Google Cloud", "GKE", "Istio", "PCI", "Orbitpay", "2 billion", "24/7"]
    },
    {
      "id": "t04",
      "labelSource": "starter (unreviewed)",
      "notes": "Data engineer; the job wants Databricks, Delta Lake and a cloud certification.",
      "paragraphs": [
        { "id": "p1", "section": "contact", "text": "Sneha Kulkarni", "editable": false },
        { "id": "p2", "section": "contact", "text": "Bengaluru · sneha.k@example.test · +91 99000 44444", "editable": false },
        { "id": "p3", "section": "summary", "text": "Summary", "editable": false, "heading": true },
        { "id": "p4", "section": "summary", "text": "Data engineer with five years of experience building batch and streaming pipelines on Spark and Airflow for e-commerce analytics.", "editable": true },